{
  "$schema": "https://json-schema.org/draft/2020-12/schema",
  "$id": "https://tree-doc.org/schemas/tier1.schema.json",
  "title": "Tree Document Format â€” Tier 1",
  "description": "Tier 1 extends Tier 0 with optional metadata, features, and reader version.",
  "type": "object",
  "required": ["formatVersion", "rootNodeId", "nodes", "edges"],
  "properties": {
    "formatVersion": {
      "type": "string",
      "pattern": "^\\d+\\.\\d+$"
    },
    "rootNodeId": {
      "type": "string",
      "minLength": 1
    },
    "nodes": {
      "type": "array",
      "items": { "$ref": "#/$defs/node" }
    },
    "edges": {
      "type": "array",
      "items": { "$ref": "#/$defs/edge" }
    },
    "minReaderVersion": {
      "type": "string",
      "pattern": "^\\d+\\.\\d+$",
      "description": "Minimum reader version required to correctly interpret this document"
    },
    "features": {
      "type": "array",
      "items": { "type": "string" },
      "description": "Feature flags used by this document"
    },
    "metadata": {
      "type": "object",
      "description": "Document-level metadata (title, author, created, etc.)",
      "properties": {
        "title": { "type": "string" },
        "author": { "type": "string" },
        "created": { "type": "string", "format": "date-time" },
        "modified": { "type": "string", "format": "date-time" },
        "description": { "type": "string" },
        "tags": { "type": "array", "items": { "type": "string" } }
      },
      "additionalProperties": true
    }
  },
  "additionalProperties": true,
  "$defs": {
    "node": {
      "type": "object",
      "required": ["id", "content"],
      "properties": {
        "id": { "type": "string", "minLength": 1 },
        "content": { "type": "string" },
        "metadata": { "type": "object" },
        "status": { "type": "string" },
        "treeIds": { "type": "array", "items": { "type": "string" } }
      },
      "additionalProperties": true
    },
    "edge": {
      "type": "object",
      "required": ["source", "target"],
      "properties": {
        "source": { "type": "string", "minLength": 1 },
        "target": { "type": "string", "minLength": 1 },
        "isTrunk": { "type": "boolean" },
        "label": { "type": "string" },
        "type": { "type": "string" },
        "status": { "type": "string" },
        "description": { "type": "string" },
        "treeId": { "type": "string" },
        "linkType": { "type": "string" }
      },
      "additionalProperties": true
    }
  }
}
